,distance,transcription
0,original,loafing was all very well for these fellows who knew not mister vladimir and had women to fall back upon whereas he had a woman to provide for
1,050cm,lincoln was all very well for these fellows who knew nothing but lotto man and had women to fall back upon whereas he had a woman to survive for
2,100cm,looking at all very waltardy fellows who knew not much of latimer and had written to call back to him there are two hellenic survived corps
3,150cm,making us all very welcome he called to new marcus of latimer and had a woman to call back upon for he had a woman to provide for
4,200cm,looking at all their waltzing clothes he knew not what he was out of luck and had written himself out of it for he had a woman to provide for
5,250cm,looking at all their waffles he said as he moved on to the bottom of them and the women were held back from him for he had a woman s surprise for him
6,300cm,sitting at all very well for this matter we went to the bottom of the river and within a couple of hours the boat was rowing to the high shore
